{"source_tif":"/home/lachlan/ProjectsLFS/Zhengyu/DEO/App80 DEO/10uM/05-十二月-2025/4x01.tif","source_png":"/home/lachlan/ProjectsLFS/Zhengyu/DEO-PNG/App80 DEO/10uM/05-十二月-2025/4x01.png","droplet_id":2,"droplet_quality_note":"Complete droplet with clear boundary; internal field has moderate blur and heavy fine particulate/debris, so very small organoids are uncertain. Count below reflects visually distinct organoid-like clusters.","organoid_count_visual":10,"organoids":[{"organoid_id_local":1,"center_x_px_local":176.0,"center_y_px_local":90.0,"radius_px_local":33.0,"size_class":"medium","morphology":"mixed","fusion_with_neighbors_0_to_5":2,"confidence":0.86,"note":"Prominent top-left aggregate with dense core and heterogeneous rim."},{"organoid_id_local":2,"center_x_px_local":255.0,"center_y_px_local":122.0,"radius_px_local":30.0,"size_class":"medium","morphology":"mixed","fusion_with_neighbors_0_to_5":2,"confidence":0.77,"note":"Top-central clustered structure, less sharply defined than #1."},{"organoid_id_local":3,"center_x_px_local":78.0,"center_y_px_local":256.0,"radius_px_local":29.0,"size_class":"medium","morphology":"mixed","fusion_with_neighbors_0_to_5":3,"confidence":0.74,"note":"Left-mid irregular organoid-like cluster with granular interior."},{"organoid_id_local":4,"center_x_px_local":150.0,"center_y_px_local":372.0,"radius_px_local":56.0,"size_class":"large","morphology":"solid","fusion_with_neighbors_0_to_5":5,"confidence":0.81,"note":"Large bottom-left confluent mass; likely multiple fused units."},{"organoid_id_local":5,"center_x_px_local":294.0,"center_y_px_local":371.0,"radius_px_local":45.0,"size_class":"large","morphology":"mixed","fusion_with_neighbors_0_to_5":4,"confidence":0.79,"note":"Central-lower broad structure with mixed density and partial lumen-like regions."},{"organoid_id_local":6,"center_x_px_local":458.0,"center_y_px_local":294.0,"radius_px_local":47.0,"size_class":"large","morphology":"mixed","fusion_with_neighbors_0_to_5":3,"confidence":0.82,"note":"Large right-side aggregate with multiple dense subclusters."},{"organoid_id_local":7,"center_x_px_local":361.0,"center_y_px_local":270.0,"radius_px_local":13.0,"size_class":"small","morphology":"solid","fusion_with_neighbors_0_to_5":2,"confidence":0.61,"note":"Small discrete dark focus near right-central region."},{"organoid_id_local":8,"center_x_px_local":262.0,"center_y_px_local":475.0,"radius_px_local":13.0,"size_class":"small","morphology":"solid","fusion_with_neighbors_0_to_5":3,"confidence":0.58,"note":"Small lower-central focus adjacent to larger central complex."},{"organoid_id_local":9,"center_x_px_local":373.0,"center_y_px_local":514.0,"radius_px_local":21.0,"size_class":"medium","morphology":"mixed","fusion_with_neighbors_0_to_5":2,"confidence":0.73,"note":"Lower-right organoid near droplet edge; relatively compact but heterogeneous."},{"organoid_id_local":10,"center_x_px_local":392.0,"center_y_px_local":446.0,"radius_px_local":16.0,"size_class":"medium","morphology":"uncertain","fusion_with_neighbors_0_to_5":2,"confidence":0.52,"note":"Small right-lower candidate; low contrast against particulate background."}]}