{"source_tif":"/home/lachlan/ProjectsLFS/Zhengyu/DEO/App80 DEO/10uM/05-十二月-2025/4x00.tif","source_png":"/home/lachlan/ProjectsLFS/Zhengyu/DEO-PNG/App80 DEO/10uM/05-十二月-2025/4x00.png","droplet_id":4,"droplet_quality_note":"Complete droplet crop at 4x with moderate contrast and substantial particulate background; several aggregates appear fused and a few structures are boundary-truncated, so small-object calls have lower confidence.","organoid_count_visual":13,"organoids":[{"organoid_id_local":1,"center_x_px_local":174.0,"center_y_px_local":298.0,"radius_px_local":78.0,"size_class":"large","morphology":"mixed","fusion_with_neighbors_0_to_5":5.0,"confidence":0.63,"note":"Dominant central aggregate with multiple merged lobes and mixed texture."},{"organoid_id_local":2,"center_x_px_local":300.0,"center_y_px_local":168.0,"radius_px_local":60.0,"size_class":"large","morphology":"mixed","fusion_with_neighbors_0_to_5":4.0,"confidence":0.72,"note":"Upper-right dense cluster with heterogeneous internal contrast."},{"organoid_id_local":3,"center_x_px_local":450.0,"center_y_px_local":271.0,"radius_px_local":53.0,"size_class":"large","morphology":"solid","fusion_with_neighbors_0_to_5":3.0,"confidence":0.74,"note":"Right-side dense organoid, partially clipped at droplet border."},{"organoid_id_local":4,"center_x_px_local":22.0,"center_y_px_local":260.0,"radius_px_local":33.0,"size_class":"large","morphology":"mixed","fusion_with_neighbors_0_to_5":3.0,"confidence":0.58,"note":"Left-edge partial aggregate; boundary truncation reduces certainty."},{"organoid_id_local":5,"center_x_px_local":160.0,"center_y_px_local":450.0,"radius_px_local":32.0,"size_class":"large","morphology":"mixed","fusion_with_neighbors_0_to_5":2.0,"confidence":0.56,"note":"Bottom-left aggregate near edge with irregular outline."},{"organoid_id_local":6,"center_x_px_local":327.0,"center_y_px_local":481.0,"radius_px_local":26.0,"size_class":"medium","morphology":"mixed","fusion_with_neighbors_0_to_5":2.0,"confidence":0.52,"note":"Bottom-edge partial structure; weakly separated from nearby debris."},{"organoid_id_local":7,"center_x_px_local":137.0,"center_y_px_local":120.0,"radius_px_local":20.0,"size_class":"medium","morphology":"solid","fusion_with_neighbors_0_to_5":1.0,"confidence":0.69,"note":"Compact upper-left organoid with relatively clear boundary."},{"organoid_id_local":8,"center_x_px_local":304.0,"center_y_px_local":361.0,"radius_px_local":14.0,"size_class":"medium","morphology":"uncertain","fusion_with_neighbors_0_to_5":1.0,"confidence":0.51,"note":"Small lower-mid structure; boundary softened by background granularity."},{"organoid_id_local":9,"center_x_px_local":269.0,"center_y_px_local":255.0,"radius_px_local":12.0,"size_class":"small","morphology":"cystic","fusion_with_neighbors_0_to_5":1.0,"confidence":0.57,"note":"Small ring-like body adjacent to larger material."},{"organoid_id_local":10,"center_x_px_local":260.0,"center_y_px_local":305.0,"radius_px_local":11.0,"size_class":"small","morphology":"cystic","fusion_with_neighbors_0_to_5":1.0,"confidence":0.55,"note":"Small vesicle-like organoid in central field."},{"organoid_id_local":11,"center_x_px_local":189.0,"center_y_px_local":173.0,"radius_px_local":10.0,"size_class":"small","morphology":"solid","fusion_with_neighbors_0_to_5":1.0,"confidence":0.5,"note":"Small dense focus near upper central region."},{"organoid_id_local":12,"center_x_px_local":378.0,"center_y_px_local":232.0,"radius_px_local":10.0,"size_class":"small","morphology":"solid","fusion_with_neighbors_0_to_5":1.0,"confidence":0.49,"note":"Small compact body near right-upper interior."},{"organoid_id_local":13,"center_x_px_local":101.0,"center_y_px_local":216.0,"radius_px_local":9.0,"size_class":"small","morphology":"uncertain","fusion_with_neighbors_0_to_5":1.0,"confidence":0.48,"note":"Dim small object; could be organoid or dense debris."}]}