{"source_tif":"/home/lachlan/ProjectsLFS/Zhengyu/DEO/App80 DEO/10uM/05-十二月-2025/4x00.tif","source_png":"/home/lachlan/ProjectsLFS/Zhengyu/DEO-PNG/App80 DEO/10uM/05-十二月-2025/4x00.png","droplet_id":2,"droplet_quality_note":"Complete droplet; focus acceptable but organoid field is very dense with substantial overlap/fusion, so boundaries between adjacent structures are often ambiguous at 4x.","organoid_count_visual":20,"organoids":[{"organoid_id_local":1,"center_x_px_local":202,"center_y_px_local":321,"radius_px_local":126,"size_class":"large","morphology":"mixed","fusion_with_neighbors_0_to_5":5,"confidence":0.43,"note":"Dominant fused aggregate occupying central-left region."},{"organoid_id_local":2,"center_x_px_local":361,"center_y_px_local":364,"radius_px_local":71,"size_class":"large","morphology":"mixed","fusion_with_neighbors_0_to_5":5,"confidence":0.47,"note":"Large subcluster embedded in central fused mass."},{"organoid_id_local":3,"center_x_px_local":555,"center_y_px_local":313,"radius_px_local":49,"size_class":"large","morphology":"mixed","fusion_with_neighbors_0_to_5":4,"confidence":0.55,"note":"Right-side dense aggregate with partial round contour."},{"organoid_id_local":4,"center_x_px_local":477,"center_y_px_local":413,"radius_px_local":40,"size_class":"large","morphology":"mixed","fusion_with_neighbors_0_to_5":4,"confidence":0.53,"note":"Lower-right aggregate contiguous with neighboring structures."},{"organoid_id_local":5,"center_x_px_local":384,"center_y_px_local":146,"radius_px_local":30,"size_class":"medium","morphology":"mixed","fusion_with_neighbors_0_to_5":4,"confidence":0.58,"note":"Upper-central lobulated unit with dark core."},{"organoid_id_local":6,"center_x_px_local":147,"center_y_px_local":527,"radius_px_local":20,"size_class":"medium","morphology":"cystic","fusion_with_neighbors_0_to_5":2,"confidence":0.7,"note":"Peripheral lower-left rounded cystic-like organoid."},{"organoid_id_local":7,"center_x_px_local":252,"center_y_px_local":283,"radius_px_local":14,"size_class":"medium","morphology":"solid","fusion_with_neighbors_0_to_5":3,"confidence":0.59,"note":"Small dark nodule near central-left interior."},{"organoid_id_local":8,"center_x_px_local":385,"center_y_px_local":468,"radius_px_local":13,"size_class":"medium","morphology":"cystic","fusion_with_neighbors_0_to_5":3,"confidence":0.56,"note":"Round feature in lower-central region, partly merged."},{"organoid_id_local":9,"center_x_px_local":415,"center_y_px_local":273,"radius_px_local":13,"size_class":"medium","morphology":"cystic","fusion_with_neighbors_0_to_5":3,"confidence":0.56,"note":"Small circular body in upper-central/right area."},{"organoid_id_local":10,"center_x_px_local":256,"center_y_px_local":317,"radius_px_local":12,"size_class":"medium","morphology":"solid","fusion_with_neighbors_0_to_5":3,"confidence":0.55,"note":"Compact nodule adjacent to larger fused center."},{"organoid_id_local":11,"center_x_px_local":612,"center_y_px_local":300,"radius_px_local":12,"size_class":"medium","morphology":"cystic","fusion_with_neighbors_0_to_5":2,"confidence":0.64,"note":"Right peripheral rounded structure."},{"organoid_id_local":12,"center_x_px_local":342,"center_y_px_local":474,"radius_px_local":11,"size_class":"small","morphology":"solid","fusion_with_neighbors_0_to_5":3,"confidence":0.52,"note":"Small dark nodule lower-central, in crowded field."},{"organoid_id_local":13,"center_x_px_local":112,"center_y_px_local":483,"radius_px_local":11,"size_class":"small","morphology":"cystic","fusion_with_neighbors_0_to_5":2,"confidence":0.62,"note":"Peripheral left-lower circular body."},{"organoid_id_local":14,"center_x_px_local":629,"center_y_px_local":331,"radius_px_local":11,"size_class":"small","morphology":"uncertain","fusion_with_neighbors_0_to_5":2,"confidence":0.47,"note":"Near-edge right-side feature; partial contrast makes class uncertain."},{"organoid_id_local":15,"center_x_px_local":84,"center_y_px_local":212,"radius_px_local":11,"size_class":"small","morphology":"cystic","fusion_with_neighbors_0_to_5":2,"confidence":0.6,"note":"Upper-left peripheral rounded organoid-like body."},{"organoid_id_local":16,"center_x_px_local":594,"center_y_px_local":431,"radius_px_local":10,"size_class":"small","morphology":"cystic","fusion_with_neighbors_0_to_5":2,"confidence":0.61,"note":"Lower-right peripheral round structure."},{"organoid_id_local":17,"center_x_px_local":109,"center_y_px_local":164,"radius_px_local":10,"size_class":"small","morphology":"cystic","fusion_with_neighbors_0_to_5":2,"confidence":0.62,"note":"Upper-left peripheral rounded body with lighter center."},{"organoid_id_local":18,"center_x_px_local":497,"center_y_px_local":512,"radius_px_local":10,"size_class":"small","morphology":"cystic","fusion_with_neighbors_0_to_5":2,"confidence":0.58,"note":"Lower-right small circular structure near aggregate edge."},{"organoid_id_local":19,"center_x_px_local":283,"center_y_px_local":295,"radius_px_local":9,"size_class":"small","morphology":"solid","fusion_with_neighbors_0_to_5":3,"confidence":0.5,"note":"Small dense spot in central crowded zone."},{"organoid_id_local":20,"center_x_px_local":394,"center_y_px_local":73,"radius_px_local":9,"size_class":"small","morphology":"cystic","fusion_with_neighbors_0_to_5":1,"confidence":0.57,"note":"Top peripheral small rounded structure."}]}