{"source_tif":"/home/lachlan/ProjectsLFS/Zhengyu/DEO/App80 DEO/10uM/05-十二月-2025/10x00.tif","source_png":"/home/lachlan/ProjectsLFS/Zhengyu/DEO-PNG/App80 DEO/10uM/05-十二月-2025/10x00.png","droplet_id":1,"droplet_quality_note":"Complete 10x droplet with usable focus/contrast, but substantial debris and strong fusion between neighboring aggregates make some boundaries ambiguous.","organoid_count_visual":10,"organoids":[{"organoid_id_local":1,"center_x_px_local":875.1,"center_y_px_local":555.6,"radius_px_local":277.0,"size_class":"large","morphology":"solid","fusion_with_neighbors_0_to_5":5,"confidence":0.92,"note":"Dominant dense central aggregate with merged interfaces to nearby structures."},{"organoid_id_local":2,"center_x_px_local":924.5,"center_y_px_local":1267.5,"radius_px_local":249.6,"size_class":"large","morphology":"mixed","fusion_with_neighbors_0_to_5":5,"confidence":0.9,"note":"Large elongated lower aggregate; textured interior with partially fused margins."},{"organoid_id_local":3,"center_x_px_local":1367.5,"center_y_px_local":952.8,"radius_px_local":114.6,"size_class":"large","morphology":"mixed","fusion_with_neighbors_0_to_5":4,"confidence":0.84,"note":"Right-mid lobulated cluster contiguous with adjacent right-side material."},{"organoid_id_local":4,"center_x_px_local":1367.5,"center_y_px_local":696.4,"radius_px_local":91.0,"size_class":"medium","morphology":"mixed","fusion_with_neighbors_0_to_5":4,"confidence":0.8,"note":"Right-upper cluster with irregular border and partial bridge to nearby cluster."},{"organoid_id_local":5,"center_x_px_local":768.7,"center_y_px_local":210.0,"radius_px_local":72.5,"size_class":"medium","morphology":"mixed","fusion_with_neighbors_0_to_5":3,"confidence":0.78,"note":"Top cluster with granular interior and nearby attached fragments."},{"organoid_id_local":6,"center_x_px_local":353.8,"center_y_px_local":768.1,"radius_px_local":56.9,"size_class":"medium","morphology":"mixed","fusion_with_neighbors_0_to_5":2,"confidence":0.72,"note":"Left-mid oval body; moderately distinct but edge definition is soft."},{"organoid_id_local":7,"center_x_px_local":626.7,"center_y_px_local":969.6,"radius_px_local":44.5,"size_class":"medium","morphology":"cystic","fusion_with_neighbors_0_to_5":2,"confidence":0.69,"note":"Central-lower rounded organoid with lumen-like center."},{"organoid_id_local":8,"center_x_px_local":1386.0,"center_y_px_local":1300.5,"radius_px_local":41.5,"size_class":"small","morphology":"mixed","fusion_with_neighbors_0_to_5":3,"confidence":0.7,"note":"Right-lower compact cluster near larger aggregates."},{"organoid_id_local":9,"center_x_px_local":1385.0,"center_y_px_local":535.7,"radius_px_local":40.4,"size_class":"small","morphology":"mixed","fusion_with_neighbors_0_to_5":2,"confidence":0.67,"note":"Small right-upper lobulated organoid adjacent to crowded region."},{"organoid_id_local":10,"center_x_px_local":1042.2,"center_y_px_local":1568.3,"radius_px_local":36.3,"size_class":"small","morphology":"cystic","fusion_with_neighbors_0_to_5":1,"confidence":0.6,"note":"Lower-central circular organoid with ring-like boundary; partially obscured by background texture."}]}