{"source_tif":"/home/lachlan/ProjectsLFS/Zhengyu/DEO/App80 DEO/10uM/05-十二月-2025/4x00.tif","source_png":"/home/lachlan/ProjectsLFS/Zhengyu/DEO-PNG/App80 DEO/10uM/05-十二月-2025/4x00.png","droplet_id":5,"droplet_quality_note":"Complete droplet; moderate focus with dense particulate background and several touching aggregates. Count is visually estimated with fusion-aware grouping.","organoid_count_visual":8,"organoids":[{"organoid_id_local":1,"center_x_px_local":88.0,"center_y_px_local":166.0,"radius_px_local":54.0,"size_class":"large","morphology":"mixed","fusion_with_neighbors_0_to_5":5,"confidence":0.68,"note":"Upper-left aggregate; partly merged with adjacent left structures."},{"organoid_id_local":2,"center_x_px_local":116.0,"center_y_px_local":302.0,"radius_px_local":70.0,"size_class":"large","morphology":"mixed","fusion_with_neighbors_0_to_5":4,"confidence":0.64,"note":"Left-lower aggregate complex with irregular boundary and internal substructure."},{"organoid_id_local":3,"center_x_px_local":303.0,"center_y_px_local":358.0,"radius_px_local":45.0,"size_class":"medium","morphology":"mixed","fusion_with_neighbors_0_to_5":2,"confidence":0.84,"note":"Central elongated organoid with clear contour and textured interior."},{"organoid_id_local":4,"center_x_px_local":474.0,"center_y_px_local":272.0,"radius_px_local":74.0,"size_class":"large","morphology":"mixed","fusion_with_neighbors_0_to_5":3,"confidence":0.86,"note":"Large right-side aggregate; dense core with surrounding smaller attached bodies."},{"organoid_id_local":5,"center_x_px_local":402.0,"center_y_px_local":432.0,"radius_px_local":33.0,"size_class":"medium","morphology":"mixed","fusion_with_neighbors_0_to_5":3,"confidence":0.78,"note":"Lower central-right aggregate adjacent to multiple small neighbors."},{"organoid_id_local":6,"center_x_px_local":440.0,"center_y_px_local":390.0,"radius_px_local":17.0,"size_class":"small","morphology":"uncertain","fusion_with_neighbors_0_to_5":3,"confidence":0.62,"note":"Small round body between right large and lower-right clusters; partial overlap."},{"organoid_id_local":7,"center_x_px_local":234.0,"center_y_px_local":447.0,"radius_px_local":16.0,"size_class":"small","morphology":"cystic","fusion_with_neighbors_0_to_5":1,"confidence":0.73,"note":"Ring-like lower-left structure with lumen-like center."},{"organoid_id_local":8,"center_x_px_local":192.0,"center_y_px_local":357.0,"radius_px_local":14.0,"size_class":"small","morphology":"solid","fusion_with_neighbors_0_to_5":2,"confidence":0.57,"note":"Small dense body near interface of left complex and central region."}]}