{"source_tif":"/home/lachlan/ProjectsLFS/Zhengyu/DEO/App80 DEO/10uM/05-十二月-2025/4x01.tif","source_png":"/home/lachlan/ProjectsLFS/Zhengyu/DEO-PNG/App80 DEO/10uM/05-十二月-2025/4x01.png","droplet_id":3,"droplet_quality_note":"Complete droplet. Image is usable but has moderate blur/low contrast and dense fine debris; large/mid aggregates are clear, while very small candidates are uncertain and mostly excluded.","organoid_count_visual":13,"organoids":[{"organoid_id_local":1,"center_x_px_local":250.7,"center_y_px_local":100.0,"radius_px_local":57.9,"size_class":"large","morphology":"mixed","fusion_with_neighbors_0_to_5":5,"confidence":0.78,"note":"Dominant upper aggregate with multiple lobes and internal heterogeneity."},{"organoid_id_local":2,"center_x_px_local":181.2,"center_y_px_local":285.2,"radius_px_local":56.7,"size_class":"large","morphology":"mixed","fusion_with_neighbors_0_to_5":5,"confidence":0.77,"note":"Large central-lower fused aggregate; boundaries between subunits are not cleanly separable."},{"organoid_id_local":3,"center_x_px_local":316.8,"center_y_px_local":416.4,"radius_px_local":66.9,"size_class":"large","morphology":"mixed","fusion_with_neighbors_0_to_5":4.5,"confidence":0.83,"note":"Large lower-right aggregate with dense dark core and surrounding mixed texture."},{"organoid_id_local":4,"center_x_px_local":142.7,"center_y_px_local":397.5,"radius_px_local":37.8,"size_class":"medium","morphology":"mixed","fusion_with_neighbors_0_to_5":4,"confidence":0.74,"note":"Lower-left aggregate adjacent to other material; treated as one fused organoid region."},{"organoid_id_local":5,"center_x_px_local":344.6,"center_y_px_local":293.3,"radius_px_local":30.6,"size_class":"medium","morphology":"mixed","fusion_with_neighbors_0_to_5":3,"confidence":0.76,"note":"Right-middle aggregate with irregular but coherent boundary."},{"organoid_id_local":6,"center_x_px_local":240.0,"center_y_px_local":218.1,"radius_px_local":26.1,"size_class":"medium","morphology":"mixed","fusion_with_neighbors_0_to_5":3,"confidence":0.68,"note":"Mid-field elongated/branched cluster; likely partial fusion of nearby micro-structures."},{"organoid_id_local":7,"center_x_px_local":132.2,"center_y_px_local":154.7,"radius_px_local":17.6,"size_class":"small","morphology":"mixed","fusion_with_neighbors_0_to_5":2,"confidence":0.63,"note":"Upper-left-mid compact cluster with uneven internal contrast."},{"organoid_id_local":8,"center_x_px_local":194.6,"center_y_px_local":328.5,"radius_px_local":12.9,"size_class":"small","morphology":"solid","fusion_with_neighbors_0_to_5":2,"confidence":0.55,"note":"Small dark nodule within dense neighborhood; separability is moderate."},{"organoid_id_local":9,"center_x_px_local":182.3,"center_y_px_local":14.3,"radius_px_local":12.2,"size_class":"small","morphology":"solid","fusion_with_neighbors_0_to_5":1,"confidence":0.46,"note":"Top-edge small body; partly near edge of textured region, lower certainty."},{"organoid_id_local":10,"center_x_px_local":161.7,"center_y_px_local":166.7,"radius_px_local":12.1,"size_class":"small","morphology":"solid","fusion_with_neighbors_0_to_5":1.5,"confidence":0.52,"note":"Upper-mid small compact body adjacent to diffuse material."},{"organoid_id_local":11,"center_x_px_local":423.8,"center_y_px_local":194.2,"radius_px_local":11.9,"size_class":"small","morphology":"solid","fusion_with_neighbors_0_to_5":1,"confidence":0.5,"note":"Right-side peripheral small nodule; likely real but near-background noise."},{"organoid_id_local":12,"center_x_px_local":67.1,"center_y_px_local":223.4,"radius_px_local":11.4,"size_class":"small","morphology":"solid","fusion_with_neighbors_0_to_5":1,"confidence":0.51,"note":"Left-side peripheral small nodule with weak boundary contrast."},{"organoid_id_local":13,"center_x_px_local":315.8,"center_y_px_local":73.3,"radius_px_local":10.7,"size_class":"small","morphology":"solid","fusion_with_neighbors_0_to_5":1,"confidence":0.5,"note":"Upper-right small dense spot within the larger upper aggregate field."}]}