{"source_tif":"/home/lachlan/ProjectsLFS/Zhengyu/DEO/App80 DEO/10uM/05-十二月-2025/10x01.tif","source_png":"/home/lachlan/ProjectsLFS/Zhengyu/DEO-PNG/App80 DEO/10uM/05-十二月-2025/10x01.png","droplet_id":1,"droplet_quality_note":"Complete droplet is visible, but focus/contrast are soft with heavy internal debris and overlapping aggregates; several boundaries are merged, so counts are moderate-confidence visual estimates.","organoid_count_visual":10,"organoids":[{"organoid_id_local":1,"center_x_px_local":560,"center_y_px_local":815,"radius_px_local":175,"size_class":"large","morphology":"mixed","fusion_with_neighbors_0_to_5":5,"confidence":0.63,"note":"Dominant central-lower fused aggregate with heterogeneous texture and indistinct margins."},{"organoid_id_local":2,"center_x_px_local":640,"center_y_px_local":255,"radius_px_local":120,"size_class":"large","morphology":"mixed","fusion_with_neighbors_0_to_5":4.5,"confidence":0.58,"note":"Top-central dense aggregate; likely multi-organoid fusion."},{"organoid_id_local":3,"center_x_px_local":760,"center_y_px_local":1055,"radius_px_local":112,"size_class":"large","morphology":"solid","fusion_with_neighbors_0_to_5":3.5,"confidence":0.71,"note":"Bottom-right dark compact mass with relatively solid appearance."},{"organoid_id_local":4,"center_x_px_local":350,"center_y_px_local":430,"radius_px_local":33,"size_class":"medium","morphology":"cystic","fusion_with_neighbors_0_to_5":1.5,"confidence":0.78,"note":"Round left-mid structure with lumen-like center and clear rim."},{"organoid_id_local":5,"center_x_px_local":280,"center_y_px_local":470,"radius_px_local":24,"size_class":"small","morphology":"cystic","fusion_with_neighbors_0_to_5":1,"confidence":0.7,"note":"Smaller circular cystic body adjacent to left-side cluster."},{"organoid_id_local":6,"center_x_px_local":780,"center_y_px_local":740,"radius_px_local":35,"size_class":"medium","morphology":"cystic","fusion_with_neighbors_0_to_5":2,"confidence":0.82,"note":"Prominent right-mid cystic organoid with bright rim."},{"organoid_id_local":7,"center_x_px_local":892,"center_y_px_local":804,"radius_px_local":22,"size_class":"small","morphology":"cystic","fusion_with_neighbors_0_to_5":1.5,"confidence":0.76,"note":"Small ring-like cystic structure near right-mid region."},{"organoid_id_local":8,"center_x_px_local":986,"center_y_px_local":754,"radius_px_local":25,"size_class":"medium","morphology":"cystic","fusion_with_neighbors_0_to_5":1,"confidence":0.72,"note":"Right-edge cystic body; edge blur reduces certainty slightly."},{"organoid_id_local":9,"center_x_px_local":430,"center_y_px_local":152,"radius_px_local":27,"size_class":"medium","morphology":"cystic","fusion_with_neighbors_0_to_5":1,"confidence":0.74,"note":"Upper-left/mid circular organoid with visible boundary."},{"organoid_id_local":10,"center_x_px_local":635,"center_y_px_local":625,"radius_px_local":46,"size_class":"medium","morphology":"mixed","fusion_with_neighbors_0_to_5":3,"confidence":0.55,"note":"Central-right textured clump; partially connected to nearby aggregates."}]}