{"source_tif":"/home/lachlan/ProjectsLFS/Zhengyu/DEO/App80 DEO/10uM/05-十二月-2025/4x02.tif","source_png":"/home/lachlan/ProjectsLFS/Zhengyu/DEO-PNG/App80 DEO/10uM/05-十二月-2025/4x02.png","droplet_id":1,"droplet_quality_note":"Complete droplet crop with clear boundary and moderate focus; interior is debris-rich with several merged aggregates, so small-object discrimination is limited.","organoid_count_visual":6,"organoids":[{"organoid_id_local":1,"center_x_px_local":116.0,"center_y_px_local":210.0,"radius_px_local":92.0,"size_class":"large","morphology":"mixed","fusion_with_neighbors_0_to_5":4.5,"confidence":0.86,"note":"Dominant left-side fused complex with dense solid regions and cystic pockets."},{"organoid_id_local":2,"center_x_px_local":282.0,"center_y_px_local":296.0,"radius_px_local":74.0,"size_class":"large","morphology":"mixed","fusion_with_neighbors_0_to_5":4.0,"confidence":0.82,"note":"Large central aggregate with heterogeneous texture and partial coalescence."},{"organoid_id_local":3,"center_x_px_local":340.0,"center_y_px_local":423.0,"radius_px_local":37.0,"size_class":"medium","morphology":"cystic","fusion_with_neighbors_0_to_5":2.0,"confidence":0.9,"note":"Well-defined oval cystic organoid near lower-right region."},{"organoid_id_local":4,"center_x_px_local":374.0,"center_y_px_local":127.0,"radius_px_local":26.0,"size_class":"medium","morphology":"solid","fusion_with_neighbors_0_to_5":1.0,"confidence":0.76,"note":"Compact upper-right organoid-like cluster, mostly solid appearance."},{"organoid_id_local":5,"center_x_px_local":146.0,"center_y_px_local":182.0,"radius_px_local":23.0,"size_class":"medium","morphology":"cystic","fusion_with_neighbors_0_to_5":3.0,"confidence":0.72,"note":"Ring-like lumen structure embedded at edge of left fused complex."},{"organoid_id_local":6,"center_x_px_local":224.0,"center_y_px_local":364.0,"radius_px_local":12.0,"size_class":"small","morphology":"cystic","fusion_with_neighbors_0_to_5":1.5,"confidence":0.55,"note":"Small circular lumen-like body in lower-central field; weak contrast."}]}