{"source_tif":"/home/lachlan/ProjectsLFS/Zhengyu/DEO/App80 DEO/10uM/05-十二月-2025/4x02.tif","source_png":"/home/lachlan/ProjectsLFS/Zhengyu/DEO-PNG/App80 DEO/10uM/05-十二月-2025/4x02.png","droplet_id":2,"droplet_quality_note":"Complete 4x droplet with clear boundary; interior is debris-dense and slightly low-contrast, so small-object calls are moderate confidence.","organoid_count_visual":12,"organoids":[{"organoid_id_local":1,"center_x_px_local":320,"center_y_px_local":251,"radius_px_local":43,"size_class":"large","morphology":"mixed","fusion_with_neighbors_0_to_5":4,"confidence":0.87,"note":"Dominant central organoid/aggregate with dense solid core and diffuse peripheral material."},{"organoid_id_local":2,"center_x_px_local":228,"center_y_px_local":39,"radius_px_local":33,"size_class":"large","morphology":"mixed","fusion_with_neighbors_0_to_5":2,"confidence":0.58,"note":"Top-edge aggregate; partially clipped by droplet border region."},{"organoid_id_local":3,"center_x_px_local":451,"center_y_px_local":224,"radius_px_local":18,"size_class":"medium","morphology":"mixed","fusion_with_neighbors_0_to_5":2,"confidence":0.74,"note":"Right-upper compact aggregate adjacent to central field."},{"organoid_id_local":4,"center_x_px_local":498,"center_y_px_local":235,"radius_px_local":14,"size_class":"small","morphology":"solid","fusion_with_neighbors_0_to_5":1,"confidence":0.62,"note":"Small right-edge dense focus; near border and somewhat ambiguous."},{"organoid_id_local":5,"center_x_px_local":81,"center_y_px_local":240,"radius_px_local":19,"size_class":"medium","morphology":"cystic","fusion_with_neighbors_0_to_5":1,"confidence":0.76,"note":"Left-upper-mid ring-like structure with visible lumen."},{"organoid_id_local":6,"center_x_px_local":142,"center_y_px_local":212,"radius_px_local":16,"size_class":"medium","morphology":"cystic","fusion_with_neighbors_0_to_5":1,"confidence":0.72,"note":"Mid-left circular organoid with cystic appearance."},{"organoid_id_local":7,"center_x_px_local":64,"center_y_px_local":357,"radius_px_local":22,"size_class":"medium","morphology":"mixed","fusion_with_neighbors_0_to_5":2,"confidence":0.7,"note":"Left-mid-lower aggregate with heterogeneous texture."},{"organoid_id_local":8,"center_x_px_local":55,"center_y_px_local":423,"radius_px_local":26,"size_class":"medium","morphology":"mixed","fusion_with_neighbors_0_to_5":2,"confidence":0.66,"note":"Lower-left aggregate; partly peripheral and debris-rich."},{"organoid_id_local":9,"center_x_px_local":177,"center_y_px_local":438,"radius_px_local":20,"size_class":"medium","morphology":"solid","fusion_with_neighbors_0_to_5":1,"confidence":0.73,"note":"Lower-left-central compact solid aggregate."},{"organoid_id_local":10,"center_x_px_local":268,"center_y_px_local":319,"radius_px_local":20,"size_class":"medium","morphology":"mixed","fusion_with_neighbors_0_to_5":2,"confidence":0.75,"note":"Center-lower organoid with dense center and diffuse edges."},{"organoid_id_local":11,"center_x_px_local":394,"center_y_px_local":512,"radius_px_local":19,"size_class":"medium","morphology":"solid","fusion_with_neighbors_0_to_5":1,"confidence":0.57,"note":"Bottom-right structure near droplet edge; partial visibility lowers confidence."},{"organoid_id_local":12,"center_x_px_local":243,"center_y_px_local":437,"radius_px_local":11,"size_class":"small","morphology":"solid","fusion_with_neighbors_0_to_5":1,"confidence":0.54,"note":"Small lower-central compact focus; weak contrast against background debris."}]}