{"source_tif":"/home/lachlan/ProjectsLFS/Zhengyu/DEO/App80 DEO/10uM/05-十二月-2025/4x00.tif","source_png":"/home/lachlan/ProjectsLFS/Zhengyu/DEO-PNG/App80 DEO/10uM/05-十二月-2025/4x00.png","droplet_id":3,"droplet_quality_note":"Complete droplet crop with usable contrast, but high fine-grain debris/background texture and several edge-touching aggregates reduce boundary certainty for some organoids.","organoid_count_visual":7,"organoids":[{"organoid_id_local":1,"center_x_px_local":55.0,"center_y_px_local":233.0,"radius_px_local":42.0,"size_class":"large","morphology":"mixed","fusion_with_neighbors_0_to_5":3.5,"confidence":0.74,"note":"Large left-edge aggregate; partially edge-touching and internally heterogeneous."},{"organoid_id_local":2,"center_x_px_local":98.0,"center_y_px_local":316.0,"radius_px_local":23.0,"size_class":"medium","morphology":"mixed","fusion_with_neighbors_0_to_5":2.5,"confidence":0.72,"note":"Left-lower rounded cluster near organoid 1 with nearby small satellites."},{"organoid_id_local":3,"center_x_px_local":226.0,"center_y_px_local":381.0,"radius_px_local":14.0,"size_class":"medium","morphology":"solid","fusion_with_neighbors_0_to_5":1.0,"confidence":0.66,"note":"Central-lower compact dark aggregate, mostly discrete from major clusters."},{"organoid_id_local":4,"center_x_px_local":505.0,"center_y_px_local":253.0,"radius_px_local":45.0,"size_class":"large","morphology":"mixed","fusion_with_neighbors_0_to_5":3.0,"confidence":0.76,"note":"Large right-edge aggregate with irregular contour and partial edge truncation."},{"organoid_id_local":5,"center_x_px_local":432.0,"center_y_px_local":322.0,"radius_px_local":15.0,"size_class":"medium","morphology":"cystic","fusion_with_neighbors_0_to_5":2.0,"confidence":0.6,"note":"Smaller right-mid spheroidal structure between major right-side aggregates."},{"organoid_id_local":6,"center_x_px_local":396.0,"center_y_px_local":437.0,"radius_px_local":39.0,"size_class":"large","morphology":"mixed","fusion_with_neighbors_0_to_5":3.5,"confidence":0.75,"note":"Dominant lower-right aggregate with multiple lobes and mixed density."},{"organoid_id_local":7,"center_x_px_local":351.0,"center_y_px_local":398.0,"radius_px_local":18.0,"size_class":"medium","morphology":"mixed","fusion_with_neighbors_0_to_5":3.0,"confidence":0.63,"note":"Satellite cluster adjacent to organoid 6; likely partially fused."}]}