{"source_tif":"/home/lachlan/ProjectsLFS/Zhengyu/DEO/App80 DEO/10uM/05-十二月-2025/4x01.tif","source_png":"/home/lachlan/ProjectsLFS/Zhengyu/DEO-PNG/App80 DEO/10uM/05-十二月-2025/4x01.png","droplet_id":1,"droplet_quality_note":"Complete droplet crop with clear boundary; internal contrast is moderate and texture is debris-rich, so very small bodies are uncertain. Major aggregates are visually distinct.","organoid_count_visual":6,"organoids":[{"organoid_id_local":1,"center_x_px_local":269.5,"center_y_px_local":130.3,"radius_px_local":98.1,"size_class":"large","morphology":"mixed","fusion_with_neighbors_0_to_5":2,"confidence":0.94,"note":"Dominant upper aggregate with multiple dense lobes and heterogeneous texture."},{"organoid_id_local":2,"center_x_px_local":286.7,"center_y_px_local":419.4,"radius_px_local":89.5,"size_class":"large","morphology":"mixed","fusion_with_neighbors_0_to_5":2,"confidence":0.92,"note":"Large lower aggregate, irregular and dense with scattered internal circular features."},{"organoid_id_local":3,"center_x_px_local":468.5,"center_y_px_local":251.4,"radius_px_local":40.4,"size_class":"medium","morphology":"mixed","fusion_with_neighbors_0_to_5":3,"confidence":0.84,"note":"Right-side clustered region with fragmented lobes; appears partially coalesced."},{"organoid_id_local":4,"center_x_px_local":235.8,"center_y_px_local":284.0,"radius_px_local":24.9,"size_class":"medium","morphology":"solid","fusion_with_neighbors_0_to_5":4,"confidence":0.78,"note":"Central bridge-like dense body between upper and lower large aggregates; likely interacting/fusing."},{"organoid_id_local":5,"center_x_px_local":415.6,"center_y_px_local":62.8,"radius_px_local":14.4,"size_class":"small","morphology":"solid","fusion_with_neighbors_0_to_5":1,"confidence":0.59,"note":"Small compact focus near upper-right interior; separable but low-detail at 4x."},{"organoid_id_local":6,"center_x_px_local":484.2,"center_y_px_local":333.6,"radius_px_local":12.7,"size_class":"small","morphology":"uncertain","fusion_with_neighbors_0_to_5":2,"confidence":0.53,"note":"Small right-lower focus adjacent to fragmented right cluster; could be a detached micro-aggregate or debris-rich body."}]}