{"source_tif":"/home/lachlan/ProjectsLFS/Zhengyu/DEO/App80 DEO/10uM/05-十二月-2025/4x00.tif","source_png":"/home/lachlan/ProjectsLFS/Zhengyu/DEO-PNG/App80 DEO/10uM/05-十二月-2025/4x00.png","droplet_id":6,"droplet_quality_note":"Complete droplet with acceptable focus, but low-contrast interior and predominantly fine particulate/single-cell debris. No clearly bounded organoid structures are visually evident.","organoid_count_visual":0,"organoids":[]}